{
  "$schema": "https://json-schema.org/draft/2020-12/schema",
  "$id": "https://raw.githubusercontent.com/api-evangelist/azure-container-apps/refs/heads/main/json-schema/azure-container-apps-managed-environment-schema.json",
  "title": "ManagedEnvironment",
  "description": "ManagedEnvironment schema from Azure Container Apps API",
  "type": "object",
  "properties": {
    "id": {
      "type": "string",
      "readOnly": true
    },
    "name": {
      "type": "string",
      "readOnly": true
    },
    "type": {
      "type": "string",
      "readOnly": true
    },
    "location": {
      "type": "string"
    },
    "tags": {
      "type": "object",
      "additionalProperties": {
        "type": "string"
      }
    },
    "properties": {
      "type": "object",
      "properties": {
        "provisioningState": {
          "type": "string",
          "readOnly": true,
          "enum": [
            "Succeeded",
            "Failed",
            "Canceled",
            "Waiting",
            "InitializationInProgress",
            "InfrastructureSetupInProgress",
            "InfrastructureSetupComplete",
            "ScheduledForDelete",
            "UpgradeRequested",
            "UpgradeFailed"
          ]
        },
        "daprAIInstrumentationKey": {
          "type": "string"
        },
        "daprAIConnectionString": {
          "type": "string"
        },
        "vnetConfiguration": {
          "type": "object",
          "properties": {
            "internal": {
              "type": "boolean"
            },
            "infrastructureSubnetId": {
              "type": "string"
            },
            "dockerBridgeCidr": {
              "type": "string"
            },
            "platformReservedCidr": {
              "type": "string"
            },
            "platformReservedDnsIP": {
              "type": "string"
            }
          }
        },
        "defaultDomain": {
          "type": "string",
          "readOnly": true
        },
        "staticIp": {
          "type": "string",
          "readOnly": true
        },
        "appLogsConfiguration": {
          "type": "object",
          "properties": {
            "destination": {
              "type": "string"
            },
            "logAnalyticsConfiguration": {
              "type": "object",
              "properties": {
                "customerId": {
                  "type": "string"
                },
                "sharedKey": {
                  "type": "string"
                }
              }
            }
          }
        },
        "zoneRedundant": {
          "type": "boolean"
        },
        "customDomainConfiguration": {
          "type": "object",
          "properties": {
            "dnsSuffix": {
              "type": "string"
            },
            "certificateValue": {
              "type": "string",
              "format": "byte"
            },
            "certificatePassword": {
              "type": "string"
            },
            "customDomainVerificationId": {
              "type": "string",
              "readOnly": true
            },
            "expirationDate": {
              "type": "string",
              "format": "date-time",
              "readOnly": true
            },
            "thumbprint": {
              "type": "string",
              "readOnly": true
            },
            "subjectName": {
              "type": "string",
              "readOnly": true
            }
          }
        },
        "workloadProfiles": {
          "type": "array",
          "items": {
            "type": "object",
            "properties": {
              "name": {
                "type": "string"
              },
              "workloadProfileType": {
                "type": "string"
              },
              "minimumCount": {
                "type": "integer"
              },
              "maximumCount": {
                "type": "integer"
              }
            }
          }
        },
        "infrastructureResourceGroup": {
          "type": "string",
          "readOnly": true
        },
        "peerAuthentication": {
          "type": "object",
          "properties": {
            "mtls": {
              "type": "object",
              "properties": {
                "enabled": {
                  "type": "boolean"
                }
              }
            }
          }
        }
      }
    }
  }
}